题目,答案要点,难度,相关岗位,标签,题目类型
碰撞持续期间会经历哪几个阶段？分别对应哪些回调函数？,OnCollisionEnter OnCollisionStay OnCollisionExit,2,Unity客户端开发,物理,场景题
Unity 中 Collider 与 Trigger（Is Trigger）有什么区别？,碰撞器是触发器的载体，而触发器只是碰撞器身 上的一个属性。 当Is Trigger=false时，碰撞器根据物理引擎引发 碰撞，产生碰撞的效果，可以调用 OnCollisionEnter/Stay/Exit函数; 当Is Trigger=true时，碰撞器被物理引擎所忽略， 没有碰撞效果，可以调用OnTriggerEnter/Stay/ Exit函数。 如果既要检测到物体的接触又不想让碰撞检测影 响物体移动或要检测一个物件是否经过空间中的 某个区域这时就可以用到触发器,1,Unity客户端开发,物理,技术知识
Unity 中物理射线检测是如何判定物体碰撞的？,从起点沿方向与场景中的 Collider 求交，返回是否命中及 RaycastHit（点、法线、距离、Collider 等）；可配合 LayerMask、最大距离与 QueryTriggerInteraction；常用于拾取、射击判定、地面检测等。,4,Unity客户端开发,物理,行为题
高速小物体撞击大物体时容易出现什么物理问题？在 Unity 中如何缓解？,易出现隧道效应（Tunneling），离散时间步内快速小球体穿过薄碰撞体而不触发碰撞。可用连续碰撞检测（CCD）、缩小时间步、Physics.SphereCast 轨迹检测、加厚碰撞体或改用射线/扫掠体预判等方式缓解。,2,Unity客户端开发,综合,技术知识
请简述 Unity 中物理射线检测（Raycast）的基本原理？,从起点沿方向与场景中的 Collider 求交，返回是否命中及 RaycastHit（点、法线、距离、Collider 等）；可配合 LayerMask、最大距离与 QueryTriggerInteraction；常用于拾取、射击判定、地面检测等。,4,Unity客户端开发,物理,技术知识
UGUI 中 Image 与 RawImage 有什么区别？各自适合哪些场景？,Image 使用 Sprite，支持九宫格/平铺等 Image Type，适合交互与样式丰富的 UI；RawImage 直接引用 Texture，适合视频帧、RenderTexture、动态图等。一般界面控件多用 Image，简单贴图展示可用 RawImage；同屏大量 UI 时注意合批与图集策略。,1,Unity客户端开发,UI,技术知识
使用 Unity 制作 2D 游戏常见有哪几种思路？,使用本身UGUI，UGUI是Unity官方推出的最新UI系统，UI就是UserInterface。 把摄像机的投影改为正交投影，不考虑Z轴. 使用Unity自身的2D模式，在2d模式中，层级视图中只有一个正交摄像机，场景视图选择的是2D模式。 使用2D TooKit插件，2D Toolkit是一组与Unity环境无缝集成的工具，提供高效的2D精灵和文本系统。,2,Unity客户端开发,综合,技术知识
导入贴图时 Texture Type 选 Texture 与选 Sprite 有什么区别？,Sprite作为UI精灵使用，Texture作用模型贴图使用。,1,Unity客户端开发,综合,技术知识
不同屏幕分辨率下，如何让 UGUI 布局保持一致、不乱版？,屏幕分辨率的自适应 性，原理就是计算出屏幕的宽高比跟原来的预设 的屏幕分辨率求出一个对比值，然后修改摄像机 的size。,3,Unity客户端开发,综合,项目经历深挖
Unity 中 Avatar 的作用是什么？和 Humanoid 动画重定向有什么关系？,用户提供的模型骨架和Unity的骨架结构进行适配，是一种骨架映射关系。 方便动画的重定向 AnimationType有三种类型 Humanoid人型：可以动画重定向，游戏对象挂载animator，子类原始模型+重定向模型，设置原始模型和使用模型的AnimationType为Humanoid类型 Generic非人型 Legacy旧版 Avatar Mask身体遮罩，身体某一部分是否受到动画影响 反向动力学 IK，通过手或脚来控制身体其他部分,2,Unity客户端开发,综合,项目经历深挖
Legacy Animation 组件里的 CrossFade 是做什么的？,Legacy Animation 组件上的交叉淡入淡出：在指定时长内平滑过渡到目标动画，同时淡出其他正在播放的动画，用于减少动作切换时的跳变。,2,Unity客户端开发,综合,项目经历深挖
请列举并说明 Legacy Animation 组件常用的若干 API（如 Play、CrossFade、Blend 等）？,AddClip 将 clip 添加到名称为 newName 的动画中。 Blend 在后续 time 秒中将名称为 animation 的动画向 targetWeight 混合。 CrossFade 在后续 time 秒的时间段内，使名称为 animation 的动画淡入，使其他动画淡出。 CrossFadeQueued 使动画在上一个动画播放完成后交叉淡入淡出。 IsPlaying 名称为 name 的动画是否正在播放？ PlayQueued 在先前的动画播放完毕后再播放动画。 RemoveClip 从动画列表中移除剪辑。 Sample 对当前状态的动画进行采样。 Stop 停止所有使用该动画启动的正在播放的动画。,2,Unity客户端开发,综合,技术知识
Skinned Mesh 动画的大致实现思路是什么？,SkinnedMesh蒙皮网格动画 分为骨骼和蒙皮两部分 骨骼是一个层次结构，存储了骨骼的Transform数据 蒙皮是mesh顶点附着在骨骼之上，顶点可以被多个骨骼影响，决定了其权重等， 还有将顶点从Mesh空间变换到骨骼空间~,3,Unity客户端开发,综合,技术知识
Unity 协程主要用来做什么？,协程Coroutine在Unity中一直扮演重要的角色。 可以实现简单的计时器、将耗时的操作拆分成几个步骤分散在每一帧去运行等等，而尽量不阻塞主线程运行。,2,Unity客户端开发,协程,技术知识
Unity 里的「协同程序」（协程）是什么？它和线程是一回事吗？,协程由 Unity 在主线程上调度，通过 IEnumerator/yield 分片执行；它不是操作系统线程，不能并行访问大部分引擎 API，适合延时、分帧、串行异步流程。,1,Unity客户端开发,综合,场景题
Unity 中如何启动和停止协程？协程适合做什么？有什么局限？,"官方案例 ) function Start ( ) { // After 0 seconds, prints ""Starting 0.0"" // After 0 seconds, prints ""Before WaitAndPrint Finishes 0.0 "" // After 2 seconds, prints ""WaitAndPrint 2.0"" // 先打印""Starting 0.0""和""Before WaitAndPrint Finishes 0.0 ""两句,2秒后打印"" WaitAndPrint 2.0 "" print ("" Starting "" + Time . time ) ;// Start function WaitAndPrint as a coroutine. And continue execution while it is running // this is the same as WaintAndPrint(2.0) as the compiler d",5,Unity客户端开发,综合,技术知识
在不同 Unity 工程之间迁移资源时，怎样做比较安全？常见做法有哪些？,连同 Library 一起拷贝工程；导出 UnityPackage；或使用版本控制只提交 Assets 与 ProjectSettings（团队规范下）；旧版还可借助 Asset Server。注意 .meta 与 GUID 成对提交，避免引用丢失。,2,Unity客户端开发,综合,项目经历深挖
PlayerPrefs 如何读写整型？还支持哪些数据类型？适用场景是什么？,本地键值持久化，常用 SetInt/GetInt；另有 SetFloat/GetFloat、SetString/GetString。适合少量设置项，不适合存档大量结构化数据；修改后可调用 PlayerPrefs.Save()（部分平台）。,2,Unity客户端开发,综合,项目经历深挖
客户端与服务器常见有哪些通信方式？,"socket通常也称作""套接字"",实现服务器和客户端之间的物理连接，并进行数据传输，主要有UDP和TCP两个协议。Socket处于网络协议的传输层。 协议传输的主要有http协议 和基于http协议的Soap协议（web service）,常见的方式是 http 的post 和get 请求，web 服务。",2,Unity客户端开发,综合,行为题
什么是序列化？在游戏或网络场景里有什么用？,序列化 简单理解成把对象转换为容易传输的格式的过程。 ⽐如，可以序列化⼀个对象，然后使⽤HTTP通过Internet在客户端和服务器端之间传输该对象,2,Unity客户端开发,综合,技术知识
UDP 与 TCP 分别是什么？主要区别有哪些？,UDP协议全称是用户数据报协议 面向无连接 面向报文， 不可靠性， 有单播，多播，广播的功能 头部开销小，传输数据报文时是很高效的。 TCP协议全称是传输控制协议是一种面向连接的、可靠的、基于字节流的传输层通信协议。三次握手、四次挥手 TCP： 面向连接 仅支持单播传输 面向字节流 可靠传输 提供拥塞控制 TCP提供全双工通信,1,Unity客户端开发,网络,技术知识
TCP/IP 协议栈分为哪几层？各层主要做什么？,网络接口层：这是协议栈的最低层，对应OSI的物理层和数据链路层，主要完成数据帧的实际发送和接收。 网络层：处理分组在网络中的活动，例如路由选择和转发等，这一层主要包括IP协议、ARP、ICMP协议等。 传输层：主要功能是提供应用程序之间的通信，这一层主要是TCP/UDP协议。 应用层：用来处理特定的应用，针对不同的应用提供了不同的协议，例如进行文件传输时用到的FTP协议，发送email用到的SMTP等。,2,Unity客户端开发,内存,技术知识
（Legacy）WWW 类常见成员与用法有哪些？新项目更推荐什么？,WWW.LoadFromCacheOrDownload：可被用于将AssetBundles自动缓存到本地磁盘 WWW.Dispose ：释放现有的 WWW 对象。 WWW.isDone：是否完成下载？（只读） WWW.progress：下载进度（只读）。,2,Unity客户端开发,综合,项目经历深挖
TCP 粘包是什么？为什么会产生？一般如何解决？,什么是粘包？ 答：顾名思义，其实就是多个独立的数据包连到一块儿。什么情况下需要考虑粘包？ 答：实际情况如下： 如果利用tcp每次发送数据，就与对方建立连接，然后双方发送完一段数据后，就关闭连接，这样就不会出现粘包问题。如果发送的数据无结构，比如文件传输，这样发送方只管发送，接收方只管接收存储就ok，也不用考虑粘包。如果双方建立连接，需要在连接后一段时间内发送不同结构数据，如连接后，有好几种结构： 1)”good good study” 2)”day day up” 那这样的话，如果发送方连续发送这个两个包出去，接收方一次接收可能会是”good good studyday day up” 这样接收方就傻了，因为协议没有规定这么奇怪的字符串，所以要把它分包处理，至于怎么分也需要双方组织一个比较好的包结构，所以一般可能会在头加一个数据长度之类的包，以确保接收。所以说：Tcp连续发送消息的时候，会出现消息一起发送过来的问题，这时候需要考虑粘包的问题。,2,Unity客户端开发,综合,技术知识
基于 TCP 的程序为什么需要封包与拆包？,为什么基于TCP的通信程序需要封包、拆包? 答：TCP是流协议，所谓流，就是没有界限的一串数据。但是程序中却有多种不同的数据包，那就很可能会出现如上所说的粘包问题，所以就需要在发送端封包，在接收端拆包。 那么如何封包、拆包？ 答：封包就是给一段数据加上包头或者包尾。比如说我们上面为解决粘包所使用的两种方法，其实就是封包与拆包的具体实现。,2,Unity客户端开发,综合,行为题
Socket 客户端高并发发送时，为何常用队列做发送协调？,项目中采用了socket通信，通过TCP发送数据给服务器端，因为项目需要，要同时开启大量的线程去发送不同的数据给服务器端，然后服务器端返回不同的数据。由于操作频繁，经常会阻塞，或没有接收到服务器端返回的数据； 因此考虑到使用一个队列：将同一ip下的数据存入一个队列中，通过队列协调发送；当第一条数据发送出去没有收到服务器端返回的数据时，让第二条数据插入队列中排队，当第三条数据也发送出来后，继续排队，以此类推； 如果当第四条数据发出来的时候，存入队列中，第一条数据收服务器端返回数据后，队列中的第二条第三条数据就扔掉，直接发送第四条数据,2,Unity客户端开发,综合,技术知识
Lightmap（光照贴图）是什么？有什么用处？,LightMap：就是指在三维软件⾥实现打好光，然后渲染把场景各表⾯的光照输出到贴图上，最后⼜通过引擎贴到场景上，这样就使物体有了光照的感觉。,1,Unity客户端开发,综合,项目经历深挖
什么是 Mipmap？有什么作用？,MipMapping：在三维计算机图形的贴图渲染中有常⽤的技术，为加快渲染进度和减少图像锯⻮，贴图被处理成由⼀系列被预先计算和优化过的图⽚组成的⽂件，这样的贴图被称为MipMap。,2,Unity客户端开发,综合,项目经历深挖
Alpha Test（裁剪透明）适合什么场合？与 Alpha Blend 相比效果有何不同？,Alpha Test，中文就是透明度测试。 简而言之就是V&F shader中最后fragment函数输出的该点颜色值（即上一讲frag的输出half4）的alpha值与固定值进行比较。Alpha Test语句通常于Pass{}中的起始位置。Alpha Test产生的效果也很极端，要么完全透明，即看不到，要么完全不透明。,4,Unity客户端开发,综合,场景题
MeshRenderer 的 material 与 sharedMaterial 有什么区别？,修改sharedMaterial将改变所有物体使用这个材质 的外观，并且也改变储存在工程里的材质设置。 不推荐修改由sharedMaterial返回的材质。如果你 想修改渲染器的材质，使用material替代。,1,Unity客户端开发,综合,技术知识
如何在 Game 视图查看 Stats？Draw Call 过高时常见优化思路有哪些？,在Game视图右上⻆点击Stats。降低Draw Call 的技术是Draw Call Batching,2,Unity客户端开发,综合,场景题
本影与半影分别指什么？阴影计算的大致原理是什么？,本影和半影： 本影：景物表⾯上那些没有被光源直接照射的区域 （全⿊的轮廓分明的区域）。 半影：景物表⾯上那些被某些特定光源直接照射但并⾮被所有特定光源直接照射的区域（半明半暗区域） ⼯作原理：从光源处向物体的所有可⻅⾯投射光线，将这些⾯投影到场景中得到投影⾯，再将这些投影⾯与场景中的其他平⾯求交得出阴影多边形，保存这些阴影多边形信息，然后再按视点位置对场景进⾏相应处理得到所要求的视图（利⽤空间换时间，每次只需依据视点位置进⾏⼀次阴影计算即可，省去了⼀次消隐过程）,4,Unity客户端开发,综合,技术知识
简述⼀下对象池，你觉得在FPS里哪些东西适合使用对象池？,对象池就存放需要被反复调⽤资源的⼀个空间，⽐如游戏中要常被大量复制的对象，⼦弹，敌⼈，以及任何重复出现的对象。,1,Unity客户端开发,综合,技术知识
什么是 Draw Call？过高有什么影响？常见降低手段有哪些？,Unity中，每次引擎准备数据并通知GPU的过程称为一次Draw Call。DrawCall越高对显卡的消耗就越大。降低DrawCall的方法： Dynamic Batching Static Batching 高级特性Shader降级为统一的低级特性的Shader。,3,Unity客户端开发,综合,技术知识
动态合批与静态合批分别是什么？各有什么取舍？,如果动态物体共用着相同的材质，那么Unity会自动对 这些物体进行批处理。动态批处理操作是自动完成 的，并不需要你进行额外的操作。 区别 ：动态批处理一切都是自动的，不需要做任何操 作，而且物体是可以移动的，但是限制很多。 静态批 处理:自由度很高，限制很少，缺点可能会占用更多 的内存，而且经过静态批处理后的所有物体都不可以 再移动了。,1,Unity客户端开发,UI,技术知识
移动端贴图压缩为何常选 ETC/PVRTC？透明通道分离大致解决什么问题？,最初我们使用了DXT5作为贴图压缩格式，希望能减小贴图的内存占用，但很快发现移动平台的显卡是不支持的。因此对于一张1024x1024大小的RGBA32贴图，虽然DXT5可将它从4MB压缩到1MB，但系统将它送进显卡之前，会先用CPU在内存里将它解压成4MB的RGBA32格式（软件解压），然后再将这4MB送进显存。于是在这段时间里，这张贴图就占用了5MB内存和4MB显存；而移动平台往往没有独立显存，需要从内存里抠一块作为显存，于是原以为只占1MB内存的贴图实际却占了9MB！ 所有不支持硬件解压的压缩格式都有这个问题。经过一番调研，我们发现安卓上硬件支持最广泛的格式是ETC，苹果上则是PVRTC。,5,Unity客户端开发,综合,技术知识
贴图 Import Settings 里 Read/Write Enabled 打开或关闭各有什么影响？,Unity中导入的每张贴图都有一个启用可读可写（Read/Write Enabled）的开关，对应的程序参数是TextureImporter.isReadable。 选中贴图后可在Import Setting选项卡中看到这个开关。只有打开这个开关，才可以对贴图使用Texture2D.GetPixel，读取或改写贴图资源的像素，但这就需要系统在内存里保留一份贴图的拷贝，以供CPU访问。 一般游戏运行时不会有这样的需求，因此我们对所有贴图都关闭了这个开关，只在编辑中做贴图导入后处理（比如对原始贴图分离透明通道）时打开它。 这样，上文提到的1024x1024大小的贴图，其运行时的2MB内存占用又可以少一半，减小到1MB。,2,Unity客户端开发,综合,场景题
下面这段字符串代码会产生哪些临时对象？,"string a = new string ( ""abc"" ) ; a = ( a . ToUpper ( ) + ""123"" ) . Substring ( 0 , 2 ) ; 在 C# 中第⼀⾏是会出错的（Java中倒是可⾏）。 应该这样初始化： string b = new string ( new char [ ] { 'a' , 'b' , 'c' } ) ; 三个临时对象：abc、ABC、AB",2,Unity客户端开发,综合,技术知识
Unity脚本从唤醒到销毁有着一套比较完整的生命周期，列出系统自带的几个重要的方法？,Awake — OnEnable — Start — FixedUpdate — Update — LateUpdate— OnGUI — OnDisable — OnDestroy 主要执行顺序 编辑器 初始化 物理系统 输入事件 游戏逻辑 场景渲染 GUI渲染 物体激活或禁用 销毁物体 应用结束 主要函数介绍 Reset 是在用户点击检视面板的Reset按钮或者首次添加该组件时被调用。此函数只在编辑模式下被调用。Reset最常用于在检视面板中给定一个最常用的默认值。Awake 用于在游戏开始之前初始化变量或游戏状态。在脚本整个生命周期内它仅被调用一次，当脚本设置为不可用时，运行时Awake方法仍然会执行一次。,3,Unity客户端开发,综合,技术知识
Unity 脚本主要使用什么语言？历史上还支持过哪些？,Unity的脚本语言基于Mono的.Net平台上运行，可以使用.NET库，这也为XML、数据库、正则表达式等问题提供了很好的解决方案。 Unity里的脚本都会经过编译，他们的运行速度也很快。这三种语言实际上的功能和运行速度是一样的，区别主要体现在语言特性上。 Unity支持的语言：C#，UnityScript（已弃用）,1,Unity客户端开发,综合,行为题
.NET 与 Mono 是什么关系？对 Unity 有什么意义？,mono是.net的一个开源跨平台工具，就类似java虚拟机，java本身不是跨平台语言，但运行在虚拟机上就能够实现了跨平台。 .net只能在windows下运行，mono可以实现跨平台编译运行，可以运行于Linux，Unix，Mac OS等。,2,Unity客户端开发,综合,技术知识
相机跟随逻辑通常写在哪个生命周期函数里？为什么？,LateUpdate ，是在所有的Update结束后才调用，比较适合用于命令脚本的执行。 官网上例子是摄像机的跟随，都是所有的Update操作完才进行摄像机的跟进，不然就有可能出现摄像机已经推进了，但是视角里还未有角色的空帧出现。,2,Unity客户端开发,综合,行为题
物理相关逻辑应放在哪个生命周期函数？为什么？,在Unity中，物理更新通常放在 FixedUpdate 函数中，而不是放在 Update 函数中。Update 函数是每一帧都会调用的函数，用于处理物体的位置、旋转和缩放等变换，但它不适用于物理计算，因为它的执行频率高于 FixedUpdate 。FixedUpdate 函数在每一帧的固定时间间隔内调用，用于执行物理模拟和碰撞检测。因此，如果你的代码涉及到物理模拟或碰撞检测，应该放在 FixedUpdate 函数中。以下是一个简单的示例，演示如何在Unity中将物理更新放在 FixedUpdate 函数中： using UnityEngine ;,3,Unity客户端开发,综合,技术知识
四元数用于表示旋转时相对欧拉角有什么优势？,四元数⽤于表示旋转，对旋转⻆度进⾏计算时⽤到四元数 相对欧拉⻆的优点： 1）能进⾏增量旋转 2）避免万向锁 3）给定⽅位的表达⽅式有两种，互为负（欧拉⻆有⽆数种表达⽅式）,1,Unity客户端开发,综合,技术知识
Transform 的 localPosition 与 position 有什么区别？,localPosition :自身坐标系，相对于父级的位置 Position ：世界坐标系中的位置,1,Unity客户端开发,综合,技术知识
请简述进程、线程、协程各自是什么，以及它们的关系？,进程 保存在硬盘上的程序运行以后，会在内存空间里形成一个独立的内存体，这个内存体有自己独立的地址空间，有自己的堆，不同进程间可以进行进程间通信，上级挂靠单位是操作系统。一个应用程序相当于一个进程，操作系统会以进程为单位，分配系统资源（CPU 时间片、内存等资源），进程是资源分配的最小单位。线程 线程从属于进程，也被称为轻量级进程，是程序的实际执行者。线程是操作系统能够进行运算调度的最小单位。它被包含在进程之中，是进程中的实际运作单位。,2,Unity客户端开发,协程,技术知识
Unity 中协程（Coroutine）主要用来解决什么问题？,在Unity中，协程是一种轻量级的线程，用于在单一线程上执行多个任务，实现异步等待和延迟执行等效果。协程不是取代线程，而是抽象于线程之上，同一时间只有一个协程拥有运行权，相当于单线程的能力。协程的执行基于迭代器，通过yield语句来实现暂停和恢复执行，从而更加灵活地控制协程的执行过程。协程可以在不创建新线程的情况下实现异步等待和延迟执行，避免了线程切换和同步等问题，从而提高了程序的性能和效率。在Unity中，协程通常用于处理一些异步任务，比如等待一段时间、播放动画、加载资源等。,4,Unity客户端开发,协程,技术知识
Unity 协程在实现层面大致是如何工作的？,协程是通过迭代器来实现功能的，通过关键字IEnumerator来定义一个迭代方法。StartCoroutine 接受到的是一个 IEnumerator ，这是个接口，并且是枚举器或迭代器的意思。yield 是 C 的一个关键字，也是一个语法糖，背后的原理会生成一个类，并且也是一个枚举器，而且不同于 return，yield 可以出现多次。yield 实际上就是返回一次结果，因为我们要一次一次枚举一个值出来，所以多个 yield 其实是个状态模式，第一个 yield 是状态 1，第二个 yield 是状态 2，每次访问时会基于状态知道当前应该执行哪一个 yield，取得哪一个值。从程序的角度讲，协程的核心就是 迭代器 。,4,Unity客户端开发,协程,场景题
操作系统线程与 Unity 协程有什么本质区别？,协程：即协作式程序，其思想是，一系列互相依赖的协程间依次使用CPU，每次只有一个协程工作，而其他协程处于休眠状态。协程实际上是在一个线程中，只不过每个协程对CPU进行分时，协程可以访问和使用unity的所有方法和component。同一时间只能执行某个协程。开辟多个协程开销不大。协程适合对某任务进行分时处理。,4,Unity客户端开发,协程,技术知识
Invoke 与 InvokeRepeating 是什么？使用上有何注意点？,"Invoke Invoke() 方法是 Unity 的一种委托机制 如： Invoke(“Test”, 3); 它的意思是：3 秒之后调用 Test() 方法； 使用 Invoke() 方法需要注意 以下3点： 1 ：它应该在 脚本的生命周期里的（Start、Update、OnGUI、FixedUpdate、LateUpdate）中被调用； 2：Invoke(); 不能接受含有参数的方法； 3：在 Time.timeScale = 0; 时， Invoke() 无效，因为它不会被调用。 InvokeRepeating InvokeRepeating(“Test”, 3 , 5); 这个方法的意思是指：3 秒后调用 Test() 方法，并且之后每隔 5 秒调用一次 Test() 方法。",1,Unity客户端开发,综合,行为题
Invoke 与协程在调度方式上有什么区别？,Invoke方法：执行没有被挂起，相当于设置完被调用函数的执行时间后即时向下执行。应用到每隔一段时间执行某个函数很方便。 Coroutine方法：新开一条执行序列（跟新建线程差不多）并挂起，等待中断指令结束。开销不大。当需要挂起当前执行时使用。 协程的效率比Invoke高。,1,Unity客户端开发,协程,技术知识
